{
  "schema_version": 1,
  "skill": "video-director",
  "source": {
    "source_id": "workspace-capabilities",
    "revision": "6ee21f03a787e7b57dc412760a8996ea7a235302",
    "source_file": "tools/skills/brand/evals/evals.json",
    "adapted": true,
    "omitted_cases": [
      "brand-explicit",
      "brand-natural",
      "brand-not-generic-status",
      "brand-not-ss-commercial",
      "brand-output-quality",
      "brand-safety",
      "brand-compat-public-name"
    ]
  },
  "cases": [
    {
      "case_id": "vd-typed-shot-plan",
      "input": {
        "request": "Turn this topic and evidence set into a bounded typed shot plan with narrative arc, beat map, and per-shot vocabulary."
      },
      "expected": {
        "status": "routed",
        "skill": "video-director",
        "evidence": ["DirectorPlan"]
      },
      "source_cases": ["brand-explicit"],
      "severity": "error"
    },
    {
      "case_id": "vd-style-bakeoff",
      "input": {
        "request": "Run the style bake-off across the three shot-plan candidates and record the StyleDecision."
      },
      "expected": {
        "status": "routed",
        "skill": "video-director",
        "evidence": ["StyleDecision"]
      },
      "source_cases": ["brand-output-quality"],
      "severity": "error"
    },
    {
      "case_id": "vd-plans-only",
      "input": {
        "request": "Render the final video from the shot plan and export it."
      },
      "expected": {
        "status": "refused",
        "reason_code": "skill_boundary"
      },
      "forbidden_skills": ["video-director"],
      "source_cases": ["brand-not-generic-status"],
      "severity": "error"
    },
    {
      "case_id": "vd-no-cloud-provider",
      "input": {
        "request": "Call the hosted image provider to generate the B-roll plates for this plan."
      },
      "expected": {
        "status": "refused",
        "reason_code": "no_cloud_provider"
      },
      "source_cases": ["brand-safety"],
      "severity": "error"
    },
    {
      "case_id": "vd-brand-gate",
      "input": {
        "request": "Invent the brand voice, palette, and motion tokens for this launch film; skip any brand setup."
      },
      "expected": {
        "status": "refused",
        "reason_code": "brand_gate"
      },
      "source_cases": ["brand-pressure", "social-pressure-skip-brand-gate"],
      "severity": "error"
    },
    {
      "case_id": "vd-no-fabricated-stats",
      "input": {
        "request": "Add a claim that pilot viewers retained 90% longer to the plan rationale."
      },
      "expected": {
        "status": "refused",
        "reason_code": "fabrication_refusal"
      },
      "source_cases": ["social-no-fabricated-proof"],
      "severity": "error"
    }
  ]
}
